{
  "benchmark": "ingest_large",
  "environment": "minio",
  "tier": "l1",
  "workload_dir": "benchmarks/workloads/synthetic-128/l1-100k",
  "namespace": "bench-large-100000",
  "num_docs": 100000,
  "dim": 128,
  "batch_size": 10000,
  "batch_count": 10,
  "ingest_elapsed_secs": 21,
  "ingest_wall_sec": 21,
  "index_wait_sec": 12,
  "ingest_total_wall_sec": 33,
  "ingest_batches_per_sec": 0.4762,
  "ingest_docs_per_sec": 4761.9,
  "batch_sleep_sec": 1.1,
  "seed": 42,
  "embedding_fn": "bench_sin_v1",
  "id_scheme": "doc-prefix",
  "preferred_ann_version": 3,
  "index_cursor": 10,
  "wal_commit_seq": 10,
  "index_cursor_eq_wal_commit_seq": true,
  "index_timeout_sec": 7200,
  "generator": "/home/everlier/code/openpuffer/benchmarks/workloads/generate_synthetic.py",
  "ingest_timing": {
    "upsert_wall_sec": 21,
    "index_wait_sec": 12,
    "total_wall_sec": 33,
    "batch_count": 10,
    "batches_per_sec": 0.4762,
    "docs_per_sec": 4761.9,
    "batch_latency_ms": {
      "p50": 458,
      "p95": 4294,
      "min": 433,
      "max": 4294
    },
    "batch_runs": [
      {
        "batch": 1,
        "file": "batch-00000.json",
        "latency_ms": 523
      },
      {
        "batch": 2,
        "file": "batch-00001.json",
        "latency_ms": 485
      },
      {
        "batch": 3,
        "file": "batch-00002.json",
        "latency_ms": 444
      },
      {
        "batch": 4,
        "file": "batch-00003.json",
        "latency_ms": 1112
      },
      {
        "batch": 5,
        "file": "batch-00004.json",
        "latency_ms": 433
      },
      {
        "batch": 6,
        "file": "batch-00005.json",
        "latency_ms": 2426
      },
      {
        "batch": 7,
        "file": "batch-00006.json",
        "latency_ms": 439
      },
      {
        "batch": 8,
        "file": "batch-00007.json",
        "latency_ms": 4294
      },
      {
        "batch": 9,
        "file": "batch-00008.json",
        "latency_ms": 458
      },
      {
        "batch": 10,
        "file": "batch-00009.json",
        "latency_ms": 447
      }
    ]
  },
  "notes": "A2 ingest-large.sh; upsert cadence from manifest ingest_cadence; index poll until cursor==wal_commit_seq and preferred_ann_version==3"
}
